{
  "schema_version": 1,
  "generated_from": "markdown",
  "source_markdown": "pcr.en-US.md",
  "product_category_identity": {
    "canonical_pcr_id": "pcr.agriculture-forestry-and-fishery-products.products-of-agriculture-horticulture-and-market-gardening.wheat-seed",
    "classification_refs": "CPC 3.0 01111, Wheat, seed",
    "covered_products": "cleaned wheat seed intended for sowing, including certified, foundation, registered, or comparable seed classes",
    "excluded_products": "commodity wheat grain for food, feed, starch, ethanol, or trading",
    "representative_product": "cleaned and graded wheat sowing seed at declared moisture basis",
    "production_route": "seed multiplication field plus post-harvest seed conditioning",
    "market_state": "cleaned, graded, packaged, and optionally treated wheat seed at seed plant gate or regional delivery point"
  },
  "functional_unit": {
    "what": "cleaned wheat seed for sowing",
    "how_much": "1 kg",
    "how_well": "declared seed class, treatment status, moisture basis, physical purity, and germination rate",
    "how_long_or_cycle": "one seed production crop cycle; storage duration declared separately when included",
    "reference_flow_link": "Reference amount and product flow below"
  },
  "system_boundary": {
    "rules": [
      {
        "rule_id": "system_boundary_rule_1",
        "applies_to": "foreground_system_boundary",
        "rule": "Source seed lot, fertilizer, fuel, electricity, crop protection products, seed treatment chemicals, packaging, and their transport records when they are part of the foreground data package.",
        "source_ids": []
      },
      {
        "rule_id": "system_boundary_rule_2",
        "applies_to": "foreground_system_boundary",
        "rule": "Field seed multiplication: land preparation, sowing, fertilization, irrigation where applicable, crop protection, field inspections when material, harvesting, and field drying.",
        "source_ids": []
      },
      {
        "rule_id": "system_boundary_rule_3",
        "applies_to": "foreground_system_boundary",
        "rule": "Seed conditioning: drying, cleaning, grading, testing, treatment, packaging, and storage.",
        "source_ids": []
      },
      {
        "rule_id": "system_boundary_rule_4",
        "applies_to": "foreground_system_boundary",
        "rule": "Transport to the declared gate when the reference flow is delivered seed.",
        "source_ids": []
      },
      {
        "rule_id": "system_boundary_rule_5",
        "applies_to": "foreground_system_boundary",
        "rule": "The foreground data package covers seed production to the declared gate. Downstream wheat cultivation using the seed is described in downstream use metadata when the completed dataset is consumed. Capital goods, land occupation, and land transformation are recorded when the declared data package scope includes them.",
        "source_ids": []
      },
      {
        "rule_id": "system_boundary_rule_6",
        "applies_to": "foreground_system_boundary",
        "rule": "This boundary is a data-production abstraction. A declared source seed lot is the reproduction starting condition for the foreground package. The source seed lot carries variety and lot identity; seed biomass formation is represented through field material and elementary flows such as water, nutrients, land use, emissions, and biogenic carbon accounting when declared.",
        "source_ids": []
      }
    ]
  },
  "boundary_abstraction": {
    "declared_starting_condition": "source_seed_lot",
    "starting_condition_role": "identity_and_reproduction_condition",
    "product_classification_scope": "current CPC 3.0 product category 01111, Wheat, seed",
    "recursive_input_rule": "input flow in the same product category that causes recursive tracing is recorded as declared starting condition",
    "upstream_dataset_requirement": "source seed lot disclosure and collection protocol record",
    "disclosure": "record source seed lot identity, propagation class, mass, moisture basis, treatment status, supplier or source field, and evidence"
  },
  "reference_flow_definition": {
    "reference_amount": "1 kg",
    "product_flow_ref": {
      "name": "Wheat",
      "uuid": "12da5e7d-9b93-4404-8c7d-08f98bec6238"
    },
    "flow_property_ref": {
      "uuid": "93a60a56-a3c8-11da-a746-0800200b9a66"
    },
    "unit_group_ref": {
      "uuid": "93a60a57-a4c8-11da-a746-0800200c9a66"
    },
    "reference_unit": "kg",
    "required_qualifiers": [
      "seed class or certification class",
      "treatment status",
      "moisture basis",
      "physical purity",
      "germination rate",
      "geography and declared gate",
      "packaging state"
    ]
  },
  "reference_flows": [],
  "measurement_rules": [
    {
      "id": "reference_mass",
      "applies_to": "reference product",
      "required_property_ref": {
        "name": "Mass",
        "uuid": "93a60a56-a3c8-11da-a746-0800200b9a66"
      },
      "required_unit": "kg",
      "rule": "The reference flow must be expressed as kg cleaned wheat seed for sowing."
    },
    {
      "id": "seed_count_conversion",
      "applies_to": "optional seed-count data",
      "required_property_ref": {
        "name": "Mass",
        "uuid": "93a60a56-a3c8-11da-a746-0800200b9a66"
      },
      "required_unit": "kg",
      "rule": "Seed count data may be used only when thousand-kernel weight or another transparent conversion to mass is provided."
    },
    {
      "id": "fertilizer_n_basis",
      "applies_to": "nitrogen fertilizer inputs and nitrogen emissions",
      "required_property_ref": {
        "name": "Mass",
        "uuid": "93a60a56-a3c8-11da-a746-0800200b9a66"
      },
      "required_unit": "kg",
      "rule": "Record nitrogen fertilizer as kg product and kg N when nitrogen emissions are calculated."
    },
    {
      "id": "energy_inventory",
      "applies_to": "electricity, fuel, and drying energy",
      "required_property_ref": {
        "name": "Net calorific value",
        "uuid": "93a60a56-a3c8-11da-a746-0800200c9a66"
      },
      "required_unit": "MJ or kWh",
      "rule": "State the energy unit used in each inventory row and preserve enough information for conversion."
    },
    {
      "id": "packaging_count",
      "applies_to": "count-based packaging data",
      "required_property_ref": {
        "name": "Number of items",
        "uuid": "01846770-4cfe-4a25-8ad9-919d8d378345"
      },
      "required_unit": "item",
      "rule": "Count-based packaging data must also state bag capacity or mass when packaging material quantities are calculated by mass."
    }
  ],
  "process_map": [
    {
      "id": "field_seed_multiplication",
      "name": "Field Seed Multiplication",
      "inclusion": "required",
      "inclusion_condition": "",
      "role": "foreground",
      "quantitative_reference": "harvested seed crop"
    },
    {
      "id": "seed_conditioning_and_treatment",
      "name": "Seed Conditioning and Treatment",
      "inclusion": "required",
      "inclusion_condition": "",
      "role": "foreground",
      "quantitative_reference": "cleaned seed output"
    },
    {
      "id": "storage_and_delivery",
      "name": "Storage and Delivery",
      "inclusion": "conditional",
      "inclusion_condition": "include when the declared gate is delivered seed or storage materially affects the reference flow",
      "role": "foreground/downstream",
      "quantitative_reference": "delivered seed"
    }
  ],
  "process_inventory": [
    {
      "id": "field_seed_multiplication",
      "label": "Field Seed Multiplication",
      "inputs": {
        "product": [
          {
            "row_id": "source_seed_lot_used_for_multiplication",
            "role": "Source seed lot used for multiplication",
            "name": "Wheat",
            "flow_type": "product",
            "flow_ref": {
              "uuid": "12da5e7d-9b93-4404-8c7d-08f98bec6238"
            },
            "property_unit": "Mass / kg",
            "description": "Source seed lot used for multiplication is recorded as an input product flow. Amount rule: site-specific measured mass; normalization basis: per 1,000 kg harvested seed crop.",
            "amount": {
              "expression": "site-specific measured mass",
              "value_mode": "foreground_record",
              "specificity": "site_specific",
              "basis": {
                "text": "per 1,000 kg harvested seed crop",
                "kind": "process_output"
              },
              "evidence": {
                "kind": "collected_record",
                "collection_protocol_id": "cp_source_seed_lot_mass",
                "source_ids": [
                  "unl-wheat-seeding-rate",
                  "umn-small-grain-seeding-rate"
                ]
              },
              "ranges": [
                {
                  "role": "default_estimate",
                  "lower": "0.001",
                  "upper": "0.2",
                  "unit": "kg/kg harvested seed crop",
                  "basis": "broad first-pass source seed lot mass per kg harvested seed crop",
                  "basis_kind": "process_output",
                  "evidence_kind": "reasoned_estimate",
                  "source_ids": []
                }
              ]
            }
          },
          {
            "row_id": "nitrogen_fertilizer_carrier",
            "role": "Nitrogen fertilizer carrier",
            "name": "Urea",
            "flow_type": "product",
            "flow_ref": {
              "uuid": "3f8850c0-f718-4c4b-8fcb-8fd42e03aa8e"
            },
            "property_unit": "Mass / kg",
            "description": "Nitrogen fertilizer carrier is recorded as an input product flow. Amount rule: measured product mass and kg N; normalization basis: per 1,000 kg harvested seed crop.",
            "amount": {
              "expression": "measured product mass and kg N",